Scheme Code,Scheme Name,ISIN Div Payout/ISIN Growth,ISIN Div Reinvestment,Net Asset Value,Repurchase Price,Sale Price,Date
110147,Canara Robeco Interval Scheme Series2 (Quarterly Plan2) - Regular Plan - Dividend Option,INF760K01BG4,,10.1343,10.1343,10.1343,2010-05-27
110146,Canara Robeco Interval Scheme Series2 (Quarterly Plan2) - Regular Plan - Growth Option,INF760K01BH2,,10.4246,10.4246,10.4246,2010-05-27
110148,Canara Robeco Interval Scheme Series2 (Quarterly Plan2) - Retail Plan - Dividend Option,INF760K01BI0,,10.1342,10.1342,10.1342,2010-05-27
110145,Canara Robeco Interval Scheme Series2 (Quarterly Plan2) - Retail Plan - Growth Option,INF760K01BJ8,,10.8919,10.8919,10.8919,2010-05-27
111879,Canara Robeco Short Term Fund- Institutional Plan - Growth,INF760K01688,,10.7759,10.7759,10.7759,2010-05-27
111880,Canara Robeco Short Term Fund- Institutional Plan - Monthly Dividend,INF760K01662,INF760K01670,10.1616,10.1616,10.1616,2010-05-27
112080,Canara Robeco Short Term Fund- Institutional Plan - Weekly Dividend,,INF760K01696,10.1212,10.1212,10.1212,2010-05-27
111883,Canara Robeco Short Term Fund- Regular Plan - Growth,INF760K01720,,10.7156,10.7156,10.7156,2010-05-27
111882,Canara Robeco Short Term Fund- Regular Plan - Monthly Dividend,INF760K01704,INF760K01712,10.1579,10.1579,10.1579,2010-05-27
112081,Canara Robeco Short Term Fund- Regular Plan - Weekly Dividend,,INF760K01738,10.1211,10.1211,10.1211,2010-05-27
100551,Templeton India Children’s Asset Plan-Education Plan,INF090I01AF4,,30.7568,30.7568,30.7568,2010-05-27
100553,Templeton India Children’s Asset Plan-Gift Plan - Dividend,INF090I01AG2,INF090I01AH0,40.5464,40.5464,40.5464,2010-05-27
100552,Templeton India Children’s Asset Plan-Gift Plan - Growth,INF090I01AI8,,40.5464,40.5464,40.5464,2010-05-27
102236,ING MIP Fund-Annual Dividend Option,INF084M01994,INF084M01AA0,10.3489,10.3489,10.3489,2010-05-27
102232,ING MIP Fund-Growth Option,INF084M01929,,14.0406,14.0406,14.0406,2010-05-27
102235,ING MIP Fund-Half Yearly Dividend Option,INF084M01978,INF084M01986,10.5543,10.5543,10.5543,2010-05-27
102233,ING MIP Fund-Monthly Dividend Option,INF084M01937,INF084M01945,10.2611,10.2611,10.2611,2010-05-27
102234,ING MIP Fund-Quarterly Dividend Option,INF084M01952,INF084M01960,11.1045,11.1045,11.1045,2010-05-27
112514,L&T Short Term Floating Rate Fund-Cumulative,,,13.4424,13.4424,13.4424,2010-05-27
112511,L&T Short Term Floating Rate Fund-Dividend-Daily,,,10.3650,10.3650,10.3650,2010-05-27
112513,L&T Short Term Floating Rate Fund-Dividend-Monthly,,,10.4304,10.4304,10.4304,2010-05-27
112512,L&T Short Term Floating Rate Fund-Dividend-Weekly,,,10.9636,10.9636,10.9636,2010-05-27
106553,SUNDARAM FIXED INCOME INTERVAL FUND QTRLY PLAN A INST  DIVIDEND,INF903J01BV1,,0.0000,0.0000,0.0000,2010-05-27
106555,SUNDARAM FIXED INCOME INTERVAL FUND QTRLY PLAN A INST  GROWTH,INF903J01BU3,,0.0000,0.0000,0.0000,2010-05-27
106556,SUNDARAM FIXED INCOME INTERVAL FUND QTRLY PLAN A REGULAR DIVIDEND,INF903J01BT5,,0.0000,0.0000,0.0000,2010-05-27
106554,SUNDARAM FIXED INCOME INTERVAL FUND QTRLY PLAN A REGULAR GROWTH,INF903J01BS7,,0.0000,0.0000,0.0000,2010-05-27
106701,SUNDARAM FIXED INCOME INTERVAL FUND QTRLY PLAN B INST DIVIDEND,INF903J01BZ2,,0.0000,0.0000,0.0000,2010-05-27
106703,SUNDARAM FIXED INCOME INTERVAL FUND QTRLY PLAN B INST GROWTH,INF903J01BY5,,0.0000,0.0000,0.0000,2010-05-27
106700,SUNDARAM FIXED INCOME INTERVAL FUND QTRLY PLAN B REGULAR  DIVIDEND,INF903J01BX7,,0.0000,0.0000,0.0000,2010-05-27
106702,SUNDARAM FIXED INCOME INTERVAL FUND QTRLY PLAN B REGULAR  GROWTH,INF903J01BW9,,0.0000,0.0000,0.0000,2010-05-27
106133,Tata Corporate Bond Fund Super High Investment Plan Daily Dividend,,INF277K01AF3,1010.3171,1010.3171,1010.3171,2010-05-27
112274,Birla Sun Life Basic Industries Fund - Dividend Trigger Plan,,,10.29,10.19,10.29,2010-05-27
103171,Birla Sun Life Basic Industries Fund-Plan A(Dividend),,,28.59,28.30,28.59,2010-05-27
103172,Birla Sun Life Basic Industries Fund-Plan B(Growth),,,95.27,94.32,95.27,2010-05-27
103169,Aditya Birla Sun Life Buy India Fund - Dividend - Regular Plan,INF209K01116,INF209K01CC9,22.48,22.37,22.48,2010-05-27
103170,Aditya Birla Sun Life Buy India Fund - Growth - Regular Plan,INF209K01124,,37.03,36.84,37.03,2010-05-27
111352,Bsl Comm Eq Fund-Global Multi Comm Plan - Dividend,INF209K01215,INF209K01CH8,11.5134,11.1680,11.5134,2010-05-27
111353,Bsl Comm Eq Fund-Global Multi Comm Plan - Growth,INF209K01223,,11.5134,11.1680,11.5134,2010-05-27
111344,Bsl Comm Eq Fund-Global Prec Metals Plan - Dividend,INF209K01173,INF209K01CF2,12.7007,12.3197,12.7007,2010-05-27
111346,Bsl Comm Eq Fund-Global Prec Metals Plan - Growth,INF209K01181,,12.7007,12.3197,12.7007,2010-05-27
100065,Aditya Birla Sun Life India Opportunities Fund - Dividend - Regular Plan,INF209K01280,INF209K01CK2,18.09,18.00,18.09,2010-05-27
100066,Aditya Birla Sun Life India Opportunities Fund - Growth - Regular Plan,INF209K01298,,49.69,49.44,49.69,2010-05-27
104339,Aditya Birla Sun Life Long Term Fund- Growth Option,INF209K01SD3,,12.89,12.89,12.89,2010-05-27
104338,Aditya Birla Sun Life Long Term Fund-Dividend Option,INF209K01SE1,INF209K01SF8,12.89,12.89,12.89,2010-05-27
107505,Aditya Birla Sun Life Special Situations Fund - Dividend,INF209K01553,INF209K01CX5,9.1489,9.0574,9.1489,2010-05-27
107504,Aditya Birla Sun Life Special Situations Fund - Growth,INF209K01561,,9.1489,9.0574,9.1489,2010-05-27
103237,Benchmark Derivative Fund - Dividend Plan,,,1052.5393,1052.5393,1052.5393,2010-05-27
100676,Benchmark Derivative Fund - Growth Plan,,,1389.4413,1389.4413,1389.4413,2010-05-27
106837,Benchmark Equity & Derivatives Opportunities Fund - Dividend Plan,,,10.8458,10.7645,10.8458,2010-05-27
106836,Benchmark Equity & Derivatives Opportunities Fund - Growth,,,11.5307,11.4442,11.5307,2010-05-27
111674,Benchmark S&P CNX 500 Fund - Dividend,,,10.9745,10.8099,10.9745,2010-05-27
111673,Benchmark S&P CNX 500 Fund - Growth,,,17.5438,17.2806,17.5438,2010-05-27
102806,Canara Robeco Nifty Index - Regular Plan - Dividend,INF760K01126,INF760K01134,17.5100,17.5100,17.5100,2010-05-27
102805,Canara Robeco Nifty Index - Regular Plan - Growth,INF760K01118,,26.3900,26.3900,26.3900,2010-05-27
101628,DWS Alpha Equity Fund - Dividend,INF223J01218,INF223J01226,15.44,15.29,15.44,2010-05-27
101629,DWS Alpha Equity Fund - Growth,INF223J01234,,70.96,70.25,70.96,2010-05-27
111920,DWS Alpha Equity Fund Wealth Plan - Growth Option,INF223J01267,,14.78,14.63,14.78,2010-05-27
111919,DWS Alpha Equity Fund Wealth Plan -Dividend Option,INF223J01242,INF223J01259,12.35,12.23,12.35,2010-05-27
102203,DWS Investment Opportunity Fund - Dividend Option,INF223J01275,INF223J01283,24.45,24.21,24.45,2010-05-27
102204,DWS Investment Opportunity Fund - Growth Option,INF223J01291,,35.28,34.93,35.28,2010-05-27
111918,DWS Investment Opportunity Fund Wealth Plan- Dividend Option,INF223J01309,INF223J01317,12.22,12.10,12.22,2010-05-27
111917,DWS Investment Opportunity Fund Wealth Plan- Growth Option,INF223J01325,,15.97,15.81,15.97,2010-05-27
105876,DSP BlackRock Equity Fund - Institutional Plan - Growth,INF740K01FY0,,11.451,11.451,11.451,2010-05-27
105873,DSP BlackRock India T.I.G.E.R. Fund - Institutional Plan - Dividend,INF740K01GD2,INF740K01GC4,8.901,8.901,8.901,2010-05-27
105874,DSP BlackRock India T.I.G.E.R. Fund - Institutional Plan - Growth,INF740K01GB6,,12.462,12.462,12.462,2010-05-27
105870,DSP BlackRock Opportunities Fund - Institutional Plan - Dividend,INF740K01GJ9,INF740K01GI1,9.272,9.272,9.272,2010-05-27
105869,DSP BlackRock Opportunities Fund - Institutional Plan - Growth,INF740K01GH3,,9.272,9.272,9.272,2010-05-27
107354,DSP BlackRock Technology.com   Fund - Regular Plan - Dividend,INF740K01193,INF740K01201,22.739,22.512,22.739,2010-05-27
100090,DSP BlackRock Technology.com   Fund - Regular Plan - Growth,INF740K01219,,31.132,30.821,31.132,2010-05-27
105871,DSP BlackRock Top 100 Equity Fund - Institutional  Plan - Dividend,INF740K01GG5,INF740K01GF7,12.104,12.104,12.104,2010-05-27
105872,DSP BlackRock Top 100 Equity Fund - Institutional  Plan - Growth,INF740K01GE0,,12.104,12.104,12.104,2010-05-27
102962,Fidelity Equity Fund-Dividend Option,,,19.599,19.403,19.599,2010-05-27
102961,Fidelity Equity Fund-Growth Option,,,30.971,30.661,30.971,2010-05-27
106570,Fidelity India Growth Fund - Dividend Option,,,10.675,10.568,10.675,2010-05-27
106569,Fidelity India Growth Fund - Growth Option,,,10.675,10.568,10.675,2010-05-27
103768,Fidelity India Special Situations Fund-Dividend Option,,,14.922,14.773,14.922,2010-05-27
103767,Fidelity India Special Situations Fund-Growth Option,,,16.456,16.291,16.456,2010-05-27
112289,Fidelity India Value Fund-Dividend Option,,,10.105,10.004,10.105,2010-05-27
112288,Fidelity India Value Fund-Growth Option,,,10.105,10.004,10.105,2010-05-27
105803,Fidelity International Opportunities Fund - Dividend Option,,,11.759,11.641,11.759,2010-05-27
105802,Fidelity International Opportunities Fund - Growth Option,,,11.759,11.641,11.759,2010-05-27
110826,Fortis  Equity Fund-Dividend Plan,,,10.11,10.11,10.11,2010-05-27
110825,Fortis  Equity Fund-Growth Plan,,,29.89,29.89,29.89,2010-05-27
110741,Fortis China-India Fund-Regular Plan-Dividend Option,,,8.0942,8.0942,8.0942,2010-05-27
110742,Fortis China-India Fund-Regular Plan-Growth Option,,,8.0963,8.0963,8.0963,2010-05-27
110749,Fortis Dividend Yield Fund-Dividend Option,,,10.933,10.933,10.933,2010-05-27
110748,Fortis Dividend Yield Fund-Growth Option,,,15.724,15.724,15.724,2010-05-27
110848,Fortis Future  Leaders Fund-Dividend Option,,,8.534,8.534,8.534,2010-05-27
110847,Fortis Future  Leaders Fund-Growth Option,,,8.569,8.569,8.569,2010-05-27
110778,Fortis Opportunities Fund-Dividend,,,8.927,8.927,8.927,2010-05-27
110777,Fortis Opportunities Fund-Growth,,,17.157,17.157,17.157,2010-05-27
110955,Fortis Sustainable Development Fund - Dividend Option,,,10.4682,10.4682,10.4682,2010-05-27
110956,Fortis Sustainable Development Fund - Growth Option,,,11.4932,11.4932,11.4932,2010-05-27
102270,Franklin FMCG Fund - Dividend,,,34.3075,33.9644,34.3075,2010-05-27
100523,Franklin FMCG Fund - Growth,,,54.6610,54.1144,54.6610,2010-05-27
105066,Franklin India Index Fund - BSE Plan - Dividend Plan,INF090I01908,INF090I01916,46.7334,46.2661,46.7334,2010-05-27
102320,Franklin India Index Fund - BSE Plan - Growth Plan,INF090I01924,,46.7334,46.2661,46.7334,2010-05-27
102271,Franklin Pharma Fund - Dividend,,,29.2056,28.9135,29.2056,2010-05-27
100902,Franklin Pharma Fund - Growth,,,55.1886,54.6367,55.1886,2010-05-27
103468,HDFC Focused Large-Cap Fund-Dividend,INF179K01K57,INF179K01K65,11.625,0,0,2010-05-27
103469,HDFC Focused Large-Cap Fund-Growth,INF179K01K73,,14.053,0,0,2010-05-27
101282,HDFC Index Fund-Sensex Plus( FV-Rs32.161),INF179K01LB7,,200.7463,200.7463,200.7463,2010-05-27
105227,HSBC Dividend Yield Equity Fund - Dividend,INF336L01BC0,INF336L01BB2,9.7833,9.6855,9.7833,2010-05-27
105228,HSBC Dividend Yield Equity Fund - Growth,INF336L01BD8,,9.7833,9.6855,9.7833,2010-05-27
108096,HSBC Small Cap Fund - Dividend,INF336L01AX8,INF336L01AW0,11.2550,10.9785,11.2550,2010-05-27
108097,HSBC Small Cap Fund - Growth,INF336L01AY6,,11.2550,10.9785,11.2550,2010-05-27
103028,ICICI Prudential Blended Plan A -  Dividend,INF109K01DZ0,INF109K01AO0,10.5710,10.5181,10.5710,2010-05-27
103027,ICICI Prudential Blended Plan A - Growth,INF109K01AP7,,14.0359,13.9657,14.0359,2010-05-27
105099,ICICI Prudential Equity Opportunities Fund - Institutional Growth Plan,,,12.12,12.12,12.12,2010-05-27
105098,ICICI Prudential Equity Opportunities Fund - Retail Dividend Plan,,,10.99,10.99,10.99,2010-05-27
105096,ICICI Prudential Equity Opportunities Fund - Retail Growth Plan,,,11.78,11.78,11.78,2010-05-27
103659,ICICI Prudential Fusion Fund - Institutional Option - I - Growth,,,14.00,14.00,N.A.,2010-05-27
103661,ICICI Prudential Fusion Fund-Dividend Plan,,,12.55,12.55,N.A.,2010-05-27
103660,ICICI Prudential Fusion Fund-Growth Plan,,,13.32,13.32,N.A.,2010-05-27
107377,ICICI Prudential Fusion Fund Series-III - Institutional Dividend Plan,,,11.75,11.75,N.A.,2010-05-27
107374,ICICI Prudential Fusion Fund Series-III - Institutional Growth Plan,,,11.75,11.75,N.A.,2010-05-27
107375,ICICI Prudential Fusion Fund Series-III - Retail Dividend Plan,,,11.49,11.49,N.A.,2010-05-27
107376,ICICI Prudential Fusion Fund Series-III - Retail Growth Plan,,,11.49,11.49,N.A.,2010-05-27
112068,IDFC Equity Fund -Plan B- Dividend,INF194K01243,INF194K01250,9.7751,9.7751,9.7751,2010-05-27
112069,IDFC Equity Fund -Plan B-Growth,INF194K01235,,11.6444,11.6444,11.6444,2010-05-27
111866,IDFC Imperial Equity Fund-Plan B - Dividend,INF194K01441,INF194K01458,14.0587,14.0587,14.0587,2010-05-27
111865,IDFC Imperial Equity Fund-Plan B - Growth,INF194K01433,,15.2315,15.2315,15.2315,2010-05-27
111757,IDFC  India GDP Growth Fund-Regular Plan-Dividend,INF194K01219,INF194K01227,14.3148,14.3148,14.3148,2010-05-27
111758,IDFC  India GDP Growth Fund-Regular Plan-Growth,INF194K01201,,14.3128,14.3128,14.3128,2010-05-27
111861,IDFC Premier Equity Fund-Plan B - Dividend,INF194K01375,INF194K01383,18.1457,18.1457,18.1457,2010-05-27
111862,IDFC Premier Equity Fund_Plan B - Growth,INF194K01425,,19.9738,19.9738,19.9738,2010-05-27
110463,IDFC  50-50 Strategic Sector Fund-Regular Plan-Dividend,INF194K01326,INF194K01334,12.7875,12.7875,12.7875,2010-05-27
110462,IDFC  50-50 Strategic Sector Fund-Regular Plan-Growth,INF194K01169,,12.9256,12.9256,12.9256,2010-05-27
111868,IDFC Strategic Sector (50-50) Equity Fund-Plan B - Dividend,INF194K01136,INF194K01144,14.1629,14.1629,14.1629,2010-05-27
111867,IDFC Strategic Sector (50-50) Equity Fund-Plan B - GROWTH,INF194K01151,,14.1568,14.1568,14.1568,2010-05-27
104273,ING C.U.B (Competitive Upcoming Businesses) Fund-Bonus Option,INF084M01374,,15.8700,15.8700,15.8700,2010-05-27
104274,ING C.U.B (Competitive Upcoming Businesses) Fund-Dividend Option,INF084M01358,INF084M01366,11.5900,11.5900,11.5900,2010-05-27
104275,ING C.U.B (Competitive Upcoming Businesses) Fund-Growth Option,INF084M01341,,15.8700,15.8700,15.8700,2010-05-27
103649,ING Contra Fund -Growth Option,INF084M01382,,15.0300,15.0300,15.0300,2010-05-27
103651,ING Contra Fund-Bonus Option,INF084M01416,,15.0300,15.0300,15.0300,2010-05-27
103650,ING Contra Fund-Dividend Option,INF084M01390,INF084M01408,12.8300,12.8300,12.8300,2010-05-27
100188,ING Core Equity Fund-Dividend Option,INF084M01192,INF084M01200,17.7700,17.7700,17.7700,2010-05-27
100189,ING Core Equity Fund-Growth Option,INF084M01184,,33.5900,33.5900,33.5900,2010-05-27
103162,ING Dividend Yield Fund-Dividend Option,INF084M01226,INF084M01234,18.5900,18.5900,18.5900,2010-05-27
103161,ING Dividend Yield Fund-Growth Option,INF084M01218,,20.4600,20.4600,20.4600,2010-05-27
102717,ING Domestic Opportunities Fund-Dividend Option,INF084M01168,INF084M01176,12.5800,12.5800,12.5800,2010-05-27
102716,ING Domestic Opportunities Fund-Growth Option,INF084M01150,,33.3300,33.3300,33.3300,2010-05-27
102243,ING Large Cap Equity Fund-Dividend Option,INF084M01283,INF084M01291,16.8100,16.8100,16.8100,2010-05-27
102242,ING Large Cap Equity Fund-Growth Option,INF084M01275,,25.2200,25.2200,25.2200,2010-05-27
102932,ING Midcap Fund-Dividend Option,INF084M01259,INF084M01267,15.1500,15.1500,15.1500,2010-05-27
102931,ING Midcap Fund-Growth Option,INF084M01242,,19.0800,19.0800,19.0800,2010-05-27
105619,ING Multi Manager Equity Fund - Option A- Dividend(Payout and Reinvestment),INF084M01AX2,INF084M01AY0,10.0700,10.0700,10.0700,2010-05-27
105620,ING Multi Manager Equity Fund - Option A- Growth,INF084M01AW4,,10.0700,10.0700,10.0700,2010-05-27
106387,ING OptiMix Multi Manager Equity Fund-Option B-Growth,,,10.2800,10.2800,10.2800,2010-05-27
106868,Religare Invesco AGILE Fund - Dividend Option,INF205K01114,INF205K01106,5.73,5.67,5.73,2010-05-27
106867,Religare Invesco AGILE Fund - Growth Option,INF205K01098,,5.72,5.66,5.72,2010-05-27
106946,JM AGRI & INFRA FUND - Dividend option,,,2.7410,0.0000,0.0000,2010-05-27
106947,JM AGRI & INFRA FUND - Growth option,,,2.7410,0.0000,0.0000,2010-05-27
106148,JM Contra Fund - Dividend option,,,5.3682,5.3682,5.3682,2010-05-27
106147,JM Contra Fund - Growth option,,,5.3682,5.3682,5.3682,2010-05-27
103109,JM Emerging Leaders Fund-Dividend,,,7.6871,7.6871,7.6871,2010-05-27
103108,JM Emerging Leaders Fund-Growth,,,7.6704,7.6704,7.6704,2010-05-27
104412,JM Financial Services Sector Fund - Dividend Plan,,,9.0261,9.0261,9.0261,2010-05-27
104411,JM Financial Services Sector Fund - Growth Plan,,,9.0261,9.0261,9.0261,2010-05-27
103752,JM HIFI Fund-Dividend,,,5.2801,5.2801,5.2801,2010-05-27
103751,JM HIFI Fund-Growth,,,5.2801,5.2801,5.2801,2010-05-27
102480,JM Large Cap Fund-Dividend,,,12.8072,12.8072,12.8072,2010-05-27
102481,JM Large Cap Fund-Growth,,,17.4162,17.4162,17.4162,2010-05-27
102478,JM Mid Cap Fund-Dividend,,,16.8458,16.8458,16.8458,2010-05-27
102479,JM Mid Cap Fund-Growth,,,24.5884,24.5884,24.5884,2010-05-27
111720,JM Nifty Plus Fund - Dividend Option,,,14.4693,14.4693,14.4693,2010-05-27
111721,JM Nifty Plus Fund - Growth Option,,,15.8916,15.8916,15.8916,2010-05-27
105039,JM Small & Mid-cap Fund - Regular Plan - Dividend option,,,5.5142,5.5142,5.5142,2010-05-27
105038,JM Small & Mid-cap Fund - Regular Plan - Growth option,,,5.5142,5.5142,5.5142,2010-05-27
104414,JM Telecom Sector Fund - Dividend Plan,,,6.8851,6.8851,6.8851,2010-05-27
104413,JM Telecom Sector Fund - Growth Plan,,,6.8851,6.8851,6.8851,2010-05-27
110159,JPMorgan India Alpha Fund-Dividend,,,10.242,10.140,10.242,2010-05-27
110160,JPMorgan India Alpha Fund-Growth,,,11.147,11.036,11.147,2010-05-27
105583,JPMorgan India Equity Fund - Regular Plan - Dividend Option,INF843K01054,INF843K01062,10.770,10.662,10.770,2010-05-27
105582,JPMorgan India Equity Fund - Regular Plan - Growth Option,INF843K01047,,11.599,11.483,11.599,2010-05-27
107302,JPMorgan India Mid and Small Cap Fund - Regular Plan - Dividend Option,INF843K01021,INF843K01039,6.883,6.814,6.883,2010-05-27
107301,JPMorgan India Mid and Small Cap Fund - Regular Plan - Growth Option,INF843K01013,,6.883,6.814,6.883,2010-05-27
101733,Kotak 30-(Dividend),,,28.803,28.515,28.803,2010-05-27
101734,Kotak 30-(Growth),,,91.323,90.41,91.323,2010-05-27
107393,Kotak Indo World Infrastructure Fund  - Dividend,,,6.791,6.791,6.791,2010-05-27
107394,Kotak Indo World Infrastructure Fund  - Growth,,,6.791,6.791,6.791,2010-05-27
103473,KOTAK LIFESTYLE FUND---Dividend,,,10.15,10.049,10.15,2010-05-27
103474,KOTAK LIFESTYLE FUND---Growth,,,11.719,11.602,11.719,2010-05-27
112548,L&T Contra Fund-Cumulative Option,INF917K01BU1,,9.46,9.46,9.46,2010-05-27
112547,L&T Contra Fund-Dividend Option,INF917K01BS5,INF917K01BT3,9.46,9.46,9.46,2010-05-27
112505,L&T Global Advantage Fund.-Cumulative Option,,,9.62,9.62,9.62,2010-05-27
112504,L&T Global Advantage Fund.-Dividend Option,,,6.67,6.67,6.67,2010-05-27
112459,L&T Growth Fund- Dividend payout,INF917K01148,INF917K01155,16.08,16.08,16.08,2010-05-27
112460,L&T Growth Fund-Cumulative,INF917K01163,,34.04,34.04,34.04,2010-05-27
112587,L&T Hedged Equity Fund - Cumulative,INF917K01221,,12.36,12.36,12.36,2010-05-27
112586,L&T Hedged Equity Fund - Dividend,INF917K01205,INF917K01213,8.77,8.77,8.77,2010-05-27
112502,L&T Multi-Cap Fund-Cumulative Option,,,17.16,17.16,17.16,2010-05-27
112501,L&T Multi-Cap Fund-Dividend Option,,,13.68,13.68,13.68,2010-05-27
112434,L&T Opportunities Fund- Dividend payout,INF917K01171,INF917K01189,17.70,17.70,17.70,2010-05-27
112435,L&T Opportunities Fund-Cumulative,INF917K01197,,40.42,40.42,40.42,2010-05-27
112606,L&T Small Cap Fund -Dividend Option,,,5.48,0.00,0.00,2010-05-27
112607,L&T Small Cap Fund-Cumulative Option,,,5.48,0.00,0.00,2010-05-27
109137,Mirae Asset Global Commodity Stocks - Dividend Option,INF769K01069,INF769K01051,10.5580,10.4520,10.5580,2010-05-27
109138,Mirae Asset Global Commodity Stocks - Growth Option,INF769K01044,,10.5580,10.4520,10.5580,2010-05-27
108196,Morgan Stanley A.C.E. Fund- Regular Dividend Plan,INF063A01068,INF063A01076,13.286,13.153,13.286,2010-05-27
108197,Morgan Stanley A.C.E. Fund- Regular Growth Plan,INF063A01050,,13.286,13.153,13.286,2010-05-27
111679,Morgan Stanley Growth Fund- Regular Dividend Plan,INF063A01035,INF063A01043,18.440,18.256,18.440,2010-05-27
100347,Morgan Stanley Growth Fund- Regular Growth Plan,INF063A01027,,56.590,56.024,56.590,2010-05-27
103749,Reliance Focused Large Cap Fund-Dividend Plan,INF204K01653,INF204K01661,14.0785,13.9377,14.0785,2010-05-27
103748,Reliance Focused Large Cap Fund-Growth Plan-Bonus Option,INF204K01679,,14.0785,13.9377,14.0785,2010-05-27
103747,Reliance Focused Large Cap Fund-Growth Plan-Growth Option,INF204K01687,,14.0785,13.9377,14.0785,2010-05-27
111944,Reliance Infrastructure Fund -Bonus Option,INF204K01AJ9,,10.7290,10.6217,10.7290,2010-05-27
111945,Reliance Infrastructure Fund -Dividend Option,INF204K01AK7,INF204K01AL5,10.7290,10.6217,10.7290,2010-05-27
111943,Reliance Infrastructure Fund -Growth Option,INF204K01AM3,,10.7290,10.6217,10.7290,2010-05-27
111948,Reliance Infrastructure Fund- Institutional Plan-Dividend Option,INF204K01AG5,INF204K01AH3,10.7419,10.6345,10.7419,2010-05-27
111946,Reliance Infrastructure Fund- Institutional Plan-Growth Option,INF204K01AI1,,10.7419,10.6345,10.7419,2010-05-27
107637,Reliance Natural Resources Fund-Dividend Plan-Dividend Option,INF204K01810,INF204K01828,9.2559,9.1633,9.2559,2010-05-27
107635,Reliance Natural Resources Fund-Growth Plan-Bonus Option,INF204K01836,,9.2559,9.1633,9.2559,2010-05-27
107636,Reliance Natural Resources Fund-Growth Plan-Growth Option,INF204K01844,,9.2559,9.1633,9.2559,2010-05-27
105601,PineBridge India Equity Fund- Institutional Plan- Dividend Option,INF178L01046,INF178L01053,11.642,11.584,11.642,2010-05-27
105600,PineBridge India Equity Fund- Standard Plan- Dividend Option,INF178L01012,INF178L01020,11.418,11.304,11.418,2010-05-27
105598,PineBridge India Equity Fund- Standard Plan- Growth Option,INF178L01038,,11.418,11.304,11.418,2010-05-27
107407,PineBridge Infrastructure & Economic Reform Fund - Institutional Plan-Dividend,INF178L01103,INF178L01111,8.796,8.752,8.796,2010-05-27
107406,PineBridge Infrastructure & Economic Reform Fund - Institutional Plan-Growth,INF178L01129,,8.796,8.752,8.796,2010-05-27
107408,PineBridge Infrastructure & Economic Reform Fund - Standard Plan-Dividend,INF178L01079,INF178L01087,8.668,8.581,8.668,2010-05-27
107405,PineBridge Infrastructure & Economic Reform Fund - Standard Plan-Growth,INF178L01095,,8.668,8.581,8.668,2010-05-27
105316,Principal Pnb Long Term Equity Fund - Dividend Option,,,10.57,10.52,10.57,2010-05-27
105317,Principal Pnb Long Term Equity Fund - Growth Option,,,10.57,10.52,10.57,2010-05-27
102427,Principal Resurgent India Equity Fund-Dividend,,,11.78,11.66,11.78,2010-05-27
102426,Principal Resurgent India Equity Fund-Growth,,,82.92,82.09,82.92,2010-05-27
100151,Principal Retail Equity Savings Fund - Growth Option,INF173K01CP9,,81.91,81.09,81.91,2010-05-27
103453,Principal Services Industries Fund-DIVIDEND,INF173K01999,INF173K01AA5,11.96,11.84,11.96,2010-05-27
103454,Principal Services Industries Fund-GROWTH,INF173K01981,,13.49,13.36,13.49,2010-05-27
109493,SAHARA BANKING & FINANCIAL SERVICES FUND- GROWTH OPTION,INF515L01494,,26.0159,25.7557,26.0159,2010-05-27
109494,SAHARA BANKING & FINANCIAL SERVICES FUND-DIVIDEND OPTION,INF515L01478,INF515L01486,16.4596,16.2950,16.4596,2010-05-27
101529,Sahara Growth Fund-Dividend,INF515L01155,INF515L01163,27.5260,27.2507,27.5260,2010-05-27
101528,Sahara Growth Fund-Growth,INF515L01171,,73.4177,72.6835,73.4177,2010-05-27
103730,Sahara Infrastructure Fund ---FIXED PRICING OPTION-Dividend Option,INF515L01320,INF515L01338,11.5936,11.4777,11.5936,2010-05-27
103731,Sahara Infrastructure Fund ---FIXED PRICING OPTION-Growth Option,INF515L01346,,15.8561,15.6975,15.8561,2010-05-27
103732,Sahara Infrastructure Fund ---VARIABLE PRICING OPTION-Dividend Option,INF515L01353,INF515L01361,11.9979,11.8779,11.9979,2010-05-27
103733,Sahara Infrastructure Fund ---VARIABLE PRICING OPTION-Growth Option,INF515L01379,,16.3288,16.1655,16.3288,2010-05-27
100798,Sahara Midcap Fund-Auto Payout,INF515L01247,,27.5514,27.2759,27.5514,2010-05-27
100799,Sahara Midcap Fund-Bonus,INF515L01254,,27.5514,27.2759,27.5514,2010-05-27
100797,Sahara Midcap Fund-Dividend Plan,INF515L01213,INF515L01221,18.7044,18.5174,18.7044,2010-05-27
100796,Sahara Midcap Fund-Growth Plan,INF515L01239,,27.5514,27.2759,27.5514,2010-05-27
108320,Sahara Power & Natural Resources Fund - Dividend Option,INF515L01445,INF515L01452,12.2153,12.0931,12.2153,2010-05-27
108321,Sahara Power & Natural resources Fund- Growth Option,INF515L01460,,12.2150,12.0929,12.2150,2010-05-27
112104,Sahara Star Value Fund-Dividend Option,INF515L01585,INF515L01593,11.1359,11.0245,11.1359,2010-05-27
112105,Sahara Star Value Fund-Growth Option,INF515L01601,,11.1387,11.0273,11.1387,2010-05-27
112036,Sahara Super 20 Fund - Dividend Option,INF515L01551,INF515L01569,10.5300,10.4247,10.5300,2010-05-27
112037,Sahara Super 20 Fund - Growth Option,INF515L01577,,10.5306,10.4253,10.5306,2010-05-27
103119,Sahara Wealth Plus Fund-Fixed Pricing Option-Dividend Option,INF515L01262,INF515L01270,18.2009,18.0189,18.2009,2010-05-27
103120,Sahara Wealth Plus Fund-Fixed Pricing Option-Growth Option,INF515L01288,,18.2009,18.0189,18.2009,2010-05-27
103121,Sahara Wealth Plus Fund-Variable Pricing Option-Dividend Option,INF515L01296,INF515L01304,18.8083,18.6202,18.8083,2010-05-27
103122,Sahara Wealth Plus Fund-Variable Pricing Option-Growth Option,INF515L01312,,18.8084,18.6203,18.8084,2010-05-27
112112,Shinsei Industry Leaders Fund - Dividend,,,10.12,10.02,10.12,2010-05-27
112107,Shinsei Industry Leaders Fund - Growth,,,10.12,10.02,10.12,2010-05-27
103210,Sundaram CAPEX Opportunities Fund-Dividend,INF903J01249,INF903J01256,12.3727,12.3727,12.3727,2010-05-27
103211,Sundaram CAPEX Opportunities Fund-Growth,INF903J01231,,23.4733,23.4733,23.4733,2010-05-27
107350,Sundaram Energy Opportunities Fund Dividend,INF903J01DX3,INF903J01DY1,7.8757,7.8757,0.0000,2010-05-27
