100521,Franklin India Technology Fund-Dividend,INF090I01759,INF090I01767,17.7399,17.5625,17.7399,2012-07-02
100522,Franklin India Technology Fund-Growth,INF090I01742,,62.3030,61.6800,62.3030,2012-07-02
107525,HDFC Infrastructure Fund - Dividend Option,INF179K01GE1,INF179K01GG6,9.927,9.828,9.927,2012-07-02
107524,HDFC Infrastructure Fund - Growth Option,INF179K01GF8,,9.927,9.828,9.927,2012-07-02
103407,HSBC Infrastructure Equity Fund - Growth,INF336L01255,,10.6811,10.5743,10.6811,2012-07-02
103406,HSBC Infrastructure Equity Fund- Dividend,INF336L01248,INF336L01230,9.0853,8.9944,9.0853,2012-07-02
109446,ICICI Prudential Banking and Financial Services Fund -  Dividend,INF109K01DY3,INF109K01BV3,17.38,17.21,17.38,2012-07-02
109445,ICICI Prudential Banking and Financial Services Fund -  Growth,INF109K01BU5,,17.73,17.55,17.73,2012-07-02
103313,ICICI Prudential Exports & Services Fund - Dividend,INF109K01FL5,INF109K01BA7,12.31,12.19,12.31,2012-07-02
103312,ICICI Prudential Exports & Services Fund - Growth,INF109K01BB5,,16.36,16.20,16.36,2012-07-02
100351,ICICI Prudential FMCG Fund - Dividend,INF109K01EO2,INF109K01423,49.60,49.10,49.60,2012-07-02
100352,ICICI Prudential FMCG Fund - Growth,INF109K01415,,91.77,90.85,91.77,2012-07-02
103150,ICICI Prudential Infrastructure Fund - Dividend,INF109K01FB6,INF109K01AT9,10.05,9.95,10.05,2012-07-02
103149,ICICI Prudential Infrastructure Fund - Growth,INF109K01AV5,,24.95,24.70,24.95,2012-07-02
105602,ICICI Prudential Infrastructure Fund - Institutional Option - I - Growth,INF109K01AU7,,13.70,13.56,13.70,2012-07-02
115294,ICICI Prudential Technology Fund - Dividend,INF109K01FO9,INF109K01514,19.00,18.81,19.00,2012-07-02
100363,ICICI Prudential Technology Fund - Growth,INF109K01506,,19.00,18.81,19.00,2012-07-02
114477,IDFC  Infrastructure Fund-Regular Plan-Dividend,INF194K01BZ6,INF194K01CA7,8.6004,8.6004,8.6004,2012-07-02
114476,IDFC  Infrastructure Fund-Regular Plan-Growth,INF194K01BY9,,8.5977,8.5977,8.5977,2012-07-02
108377,Invesco India Financial Services Fund - Retail Dividend,INF205K01171,INF205K01163,14.93,14.78,14.93,2012-07-02
108378,Invesco India Financial Services Fund - Retail Growth,INF205K01155,,19.26,19.07,19.26,2012-07-02
106653,Invesco India Infrastructure Fund - Dividend Option,INF205K01CE3,INF205K01CF0,6.91,6.84,6.91,2012-07-02
106654,Invesco India Infrastructure Fund - Growth Option,INF205K01CD5,,6.91,6.84,6.91,2012-07-02
112173,Invesco India PSU Equity Fund - Dividend,INF205K01353,INF205K01346,8.77,8.68,8.77,2012-07-02
112171,Invesco India PSU Equity Fund - Growth,INF205K01338,,9.72,9.62,9.72,2012-07-02
112601,L&T Infrastructure Fund - Regular Plan - Dividend,INF917K01544,INF917K01551,6.01,6.01,6.01,2012-07-02
112600,L&T Infrastructure Fund - Regular Plan - Growth,INF917K01536,,6.01,6.01,6.01,2012-07-02
107764,LIC MF Infrastructure Fund-Regular Plan-Dividend,INF767K01485,INF767K01493,7.5333,7.4580,7.5333,2012-07-02
107763,LIC MF Infrastructure Fund-Regular Plan-Growth,INF767K01501,,7.5333,7.4580,7.5333,2012-07-02
114930,Mirae Asset Great Consumer Fund - Regular Plan - Dividend Option,INF769K01150,INF769K01143,11.144,11.033,11.144,2012-07-02
114931,Mirae Asset Great Consumer Fund - Regular Plan - Growth option,INF769K01135,,11.144,11.033,11.144,2012-07-02
101864,Nippon India Banking Fund-Dividend Plan-Dividend Option,INF204K01893,INF204K01901,35.0396,34.6892,35.0396,2012-07-02
101863,Nippon India Banking Fund-Growth Plan-Bonus Option,INF204K01919,,96.5786,95.6128,96.5786,2012-07-02
101862,Nippon India Banking Fund-Growth Plan-Growth Option,INF204K01927,,96.5790,95.6132,96.5790,2012-07-02
102753,Nippon India Consumption Fund-Dividend Plan,INF204K01AN1,INF204K01AO9,16.3001,16.1371,16.3001,2012-07-02
102752,Nippon India Consumption Fund-Growth Plan-Bonus Option,INF204K01AP6,,27.9499,27.6704,27.9499,2012-07-02
102751,Nippon India Consumption Fund-Growth Plan-Growth Option,INF204K01AQ4,,27.9499,27.6704,27.9499,2012-07-02
102433,Nippon India Pharma Fund-Dividend Plan,INF204K01935,INF204K01943,39.8961,39.4971,39.8961,2012-07-02
102432,Nippon India Pharma Fund-Growth Plan-Bonus Option,INF204K01950,,58.9403,58.3509,58.9403,2012-07-02
102431,Nippon India Pharma Fund-Growth Plan-Growth Option,INF204K01968,,58.9403,58.3509,58.9403,2012-07-02
101264,Nippon India Power & Infra Fund-Dividend Plan,INF204K01AB6,INF204K01AC4,30.9003,30.5913,30.9003,2012-07-02
101262,Nippon India Power & Infra Fund-Growth Plan -Growth Option,INF204K01AE0,,54.4117,53.8676,54.4117,2012-07-02
101263,Nippon India Power & Infra Fund-Growth Plan-Bonus Option,INF204K01AD2,,54.4114,53.8673,54.4114,2012-07-02
108252,Nippon India Quant Fund -Dividend Plan,INF204K01745,INF204K01752,10.4735,10.3688,10.4735,2012-07-02
108249,Nippon India Quant Fund -Growth Plan - Growth Option,INF204K01760,,12.8187,12.6905,12.8187,2012-07-02
108258,Nippon India Quant Fund -Growth Plan -Bonus Option,INF204K01737,,12.8187,12.6905,12.8187,2012-07-02
109831,Quant Consumption Fund - Dividend Option,INF966L01432,INF966L01440,8.096,8.015,8.096,2012-07-02
109830,Quant Consumption Fund - Growth Option,INF966L01457,,11.3049,11.1919,11.3049,2012-07-02
106169,Quant Infrastructure Fund - Dividend,INF966L01507,INF966L01515,5.3302,5.304,5.3302,2012-07-02
106170,Quant Infrastructure Fund - Growth Option,,INF966L01523,5.3273,5.3011,5.3273,2012-07-02
112295,Sundaram PSU Opportunities Dividend Option,INF903J01892,INF903J01900,8.8442,8.7558,8.8442,2012-07-02
112294,Sundaram PSU Opportunities Growth Option,INF903J01884,,9.7121,9.6150,9.7121,2012-07-02
109060,Sundaram Financial Services Opportunities Fund Inst  Dividend,INF903J01637,INF903J01645,11.4256,11.4256,11.4256,2012-07-02
109061,Sundaram Financial Services Opportunities Fund Inst  Growth,INF903J01652,,18.0081,18.0081,18.0081,2012-07-02
109058,Sundaram Financial Services Opportunities Fund Reg Dividend,INF903J01603,INF903J01611,11.2894,11.1765,11.2894,2012-07-02
109059,Sundaram Financial Services Opportunities Fund Reg Growth,INF903J01629,,17.6077,17.4316,17.6077,2012-07-02
102142,Sundaram Rural and Consumption  Regular  Growth,INF903J01561,,14.3239,14.1807,14.3239,2012-07-02
113373,Sundaram Rural and Consumption Fund Inst Dividend,INF903J01579,INF903J01587,14.8073,14.8073,14.8073,2012-07-02
103743,Sundaram Rural and Consumption Fund- Regular Dividend,INF903J01546,INF903J01553,10.3638,10.2602,10.3638,2012-07-02
101833,Tata Ethical Fund Regular Plan - Dividend,INF277K01EH1,INF277K01949,39.1488,38.7573,39.1488,2012-07-02
100415,Tata Ethical Fund Regular Plan  - Growth,INF277K01956,,63.7692,63.1315,63.7692,2012-07-02
101852,Tata Infrastructure Fund-Regular Plan - Dividend,INF277K01DY8,INF277K01774,18.1339,17.9526,18.1339,2012-07-02
101766,Tata Infrastructure Fund-Regular Plan- Growth,INF277K01782,,27.5154,27.2402,27.5154,2012-07-02
117313,Taurus Banking & Financial Services Fund - Regular Plan - Dividend Option,INF044D01BJ2,INF044D01BK0,11.16,11.05,11.16,2012-07-02
117312,Taurus Banking & Financial Services Fund - Regular Plan - Growth Option,INF044D01BI4,,11.16,11.05,11.16,2012-07-02
111903,Taurus Ethical Fund -  Regular Plan - Bonus Option,INF044D01823,,21.61,21.39,21.61,2012-07-02
111788,Taurus Ethical Fund - Regular Plan - Dividend Option,INF044D01831,INF044D01849,14.59,14.44,14.59,2012-07-02
111787,Taurus Ethical Fund - Regular Plan - Growth Option,INF044D01864,,21.60,21.38,21.60,2012-07-02
105417,Taurus Infrastructure Fund - Regular Plan - Growth Option,INF044D01906,,11.55,11.43,11.55,2012-07-02
105418,Taurus Infrastructure Fund -Regular Plan - Dividend Option,INF044D01872,INF044D01880,10.87,10.76,10.87,2012-07-02
102401,UTI Banking and Financial Services Fund - Regular Plan - Growth Option,INF789F01372,,40.68,40.68,40.68,2012-07-02
102402,UTI Banking and Financial Services Fund - Regular Plan - Income Option,INF789F01356,INF789F01364,18.74,18.74,18.74,2012-07-02
100805,UTI Energy Fund-Growth Option,INF789F01497,,9.08,9.08,9.08,2012-07-02
100804,UTI Energy Fund-Income Option,INF789F01471,INF789F01489,10.3,10.3,10.3,2012-07-02
100807,UTI Healthcare Fund - Regular Plan - Growth Option,INF789F01695,,41.75,41.75,41.75,2012-07-02
100806,UTI Healthcare Fund - Regular Plan - Income Option,INF789F01679,INF789F01687,32.27,32.27,32.27,2012-07-02
100809,UTI Services Industries Fund-Growth Option,INF789F01729,,56.93,56.93,56.93,2012-07-02
100808,UTI Services Industries Fund-Income Option,INF789F01703,INF789F01711,24.48,24.48,24.48,2012-07-02
106426,UTI India Consumer Fund - Regular Plan - Dividend Option,INF789F01CF3,INF789F01CG1,12.31,12.31,12.31,2012-07-02
106425,UTI India Consumer Fund - Regular Plan - Growth Option,INF789F01CE6,,12.31,12.31,12.31,2012-07-02
102395,UTI Infrastructure Fund-Growth Option,INF789F01752,,26.86,26.86,26.86,2012-07-02
102396,UTI Infrastructure Fund-Income Option,INF789F01737,INF789F01745,15.27,15.27,15.27,2012-07-02
100740,UTI - MNC Fund - Regular Plan - Growth Option,INF789F01844,,66.71,66.71,66.71,2012-07-02
100739,UTI - MNC Fund - Regular Plan - Income Option,INF789F01828,INF789F01836,43.1,43.1,43.1,2012-07-02
102397,UTI-Transportation and Logistics Fund-Income Option,INF789F01273,INF789F01281,14.27,14.27,14.27,2012-07-02
102398,UTI-Transpotation and Logistics  Fund-Growth Option,INF789F01299,,28.5,28.5,28.5,2012-07-02
100067,Aditya Birla Sun Life Tax Plan - Regular Plan - Dividend Option,INF209K01330,INF209K01CM8,42.92,42.92,42.92,2012-07-02
104331,Aditya Birla Sun Life Tax Plan - Regular Plan - Growth Option,INF209K01348,,13.02,13.02,13.02,2012-07-02
103164,Aditya Birla Sun Life Tax Relief '96 - Dividend Option,INF209K01090,INF209K01CB1,69.44,69.44,69.44,2012-07-02
107745,Aditya Birla Sun Life Tax Relief '96 - Growth Option,INF209K01108,,10.06,10.06,10.06,2012-07-02
112322,Axis Long Term Equity Fund - Regular Plan - Dividend,INF846K01149,INF846K01156,11.7697,11.7697,11.7697,2012-07-02
112323,Axis Long Term Equity Fund - Regular Plan - Growth,INF846K01131,,12.8493,12.8493,12.8493,2012-07-02
100068,BARODA ELSS 96 - Plan A - Dividend,INF955L01641,,21.57,21.57,21.57,2012-07-02
113463,BNP Paribas Long Term Equity Fund - Growth Option,INF251K01985,,14.6130,14.6130,14.6130,2012-07-02
113464,BNP Paribas Long Term Equity Fund-Dividend Option,INF251K01AA9,INF251K01993,10.6210,10.6210,10.6210,2012-07-02
111711,BOI AXA Tax Advantage Fund-ECO Plan-Dividend,INF761K01132,INF761K01140,11.41,11.41,11.41,2012-07-02
111709,BOI AXA Tax Advantage Fund-ECO Plan-Growth,INF761K01157,,20.96,20.96,20.96,2012-07-02
111710,BOI AXA Tax Advantage Fund-Regular Plan- Growth,INF761K01181,,20.80,20.80,20.80,2012-07-02
111708,BOI AXA Tax Advantage Fund-Regular Plan-Dividend,INF761K01165,INF761K01173,11.34,11.34,11.34,2012-07-02
100593,Canara Robeco Equity Taxsaver Fund - Regular Plan - Dividend,INF760K01084,INF760K01092,17.5800,17.5800,17.5800,2012-07-02
111722,Canara Robeco Equity Taxsaver Fund - Regular Plan - Growth,INF760K01100,,26.3900,26.3900,26.3900,2012-07-02
104773,DSP Tax Saver Fund - Regular Plan - Dividend,INF740K01169,INF740K01177,11.407,11.407,11.407,2012-07-02
104772,DSP Tax Saver Fund - Regular Plan - Growth,INF740K01185,,15.987,15.987,15.987,2012-07-02
111639,Edelweiss Long Term Equity Fund (Tax Savings) - Regular Plan - Dividend Option,INF754K01525,INF754K01541,11.83,11.83,11.83,2012-07-02
111638,Edelweiss Long Term Equity Fund (Tax Savings) - Regular Plan - Growth Option,INF754K01517,,18.70,18.70,18.70,2012-07-02
100525,Franklin India Taxshield-Dividend,INF090I01783,INF090I01791,27.7304,27.7304,27.7304,2012-07-02
100526,Franklin India Taxshield-Growth,INF090I01775,,212.0039,212.0039,212.0039,2012-07-02
100997,HDFC  Long Term Advantage Fund - Dividend Option,INF179K01970,INF179K01988,30.406,30.406,30.406,2012-07-02
100998,HDFC  Long Term Advantage Fund - Growth Option,INF179K01996,,131.43,131.43,131.43,2012-07-02
101980,HDFC TaxSaver-Dividend Plan,INF179K01AZ9,INF179K01BA0,49.387,49.387,49.387,2012-07-02
101979,HDFC TaxSaver-Growth Plan,INF179K01BB8,,217.327,217.327,217.327,2012-07-02
104706,HSBC Tax Saver Equity Fund - Dividend,INF336L01AZ3,,13.1386,13.1386,13.1386,2012-07-02
104707,HSBC Tax Saver Equity Fund - Growth,INF336L01BA4,,14.2456,14.2456,14.2456,2012-07-02
100354,ICICI Prudential Long Term Equity Fund (Tax Saving) - Growth,INF109K01464,,136.38,136.38,136.38,2012-07-02
100353,ICICI Prudential Long Term Equity Fund (Tax Saving)- Dividend,INF109K01FN1,INF109K01472,17.33,17.33,17.33,2012-07-02
111570,IDFC Tax Advantage  (ELSS) Fund-Regular Plan-Dividend,INF194K01300,INF194K01318,10.5864,10.5864,10.5864,2012-07-02
111569,IDFC Tax Advantage  (ELSS) Fund-Regular Plan-Growth,INF194K01292,,18.7670,18.7670,18.7670,2012-07-02
104635,Invesco India Tax Plan - Dividend,INF205K01296,INF205K01288,11.51,11.51,11.51,2012-07-02
104636,Invesco India Tax Plan - Growth,INF205K01270,,17.19,17.19,17.19,2012-07-02
107287,JM Tax Gain Fund - Dividend option,INF192K01643,,5.9377,0.0000,5.9377,2012-07-02
107288,JM Tax Gain Fund - Growth option,INF192K01650,,5.9377,0.0000,5.9377,2012-07-02
103338,Kotak Tax Saver-Scheme-Dividend,INF174K01385,INF174K01377,10.732,10.732,10.732,2012-07-02
103339,Kotak Tax Saver-Scheme-Growth,INF174K01369,,17.526,17.526,17.526,2012-07-02
100864,LIC MF Tax Plan-Regular Plan-Dividend,INF767K01931,INF767K01949,9.6930,9.6930,9.6930,2012-07-02
100865,LIC MF Tax Plan-Regular Plan-Growth,INF767K01956,,27.0727,27.0727,27.0727,2012-07-02
100325,LIC MF ULIS (5 Yrs. Single Premium)-Regular Plan-Dividend Reinvestment,,INF767K01964,9.5839,9.5839,9.5839,2012-07-02
103197,Nippon India Tax Saver (ELSS) Fund-Dividend Plan-Dividend Payout Option,INF204K01GL2,INF204K01GM0,13.4013,13.4013,13.4013,2012-07-02
103196,Nippon India Tax Saver (ELSS) Fund-Growth Plan-Growth Option,INF204K01GK4,,21.1695,21.1695,21.1695,2012-07-02
101815,Principal Personal Tax Saver Fund,INF173K01353,,87.77,87.77,87.77,2012-07-02
100156,Principal Tax Savings Fund,INF173K01361,,70.31,70.31,70.31,2012-07-02
100174,Quant Tax Plan-Dividend,INF966L01119,INF966L01127,7.7997,7.7997,7.7997,2012-07-02
100175,Quant Tax Plan-Growth,INF966L01135,,36.2757,36.2757,36.2757,2012-07-02
111550,Quantum Tax Saving Fund - Direct Plan Dividend Option,INF082J01077,INF082J01085,22.028,22.028,22.028,2012-07-02
111549,Quantum Tax Saving Fund - Direct Plan Growth Option,INF082J01069,,22.040,22.040,22.040,2012-07-02
100614,Sundaram Diversified Equity - A Long-term Tax Saver Fund - Dividend,INF903J01512,INF903J01520,9.7767,9.7767,9.7767,2012-07-02
101853,Sundaram Diversified Equity-A Long-term Tax Saver Fund OE- App,INF903J01538,,41.4569,41.4569,41.4569,2012-07-02
100474,Tata India Tax Savings Fund-Dividend- Regular Plan,INF277K01I60,,41.7729,41.7729,41.7729,2012-07-02
100480,Taurus Tax Shield- Regular Plan - Growth Option,INF044D01AC9,,33.42,33.42,33.42,2012-07-02
108402,Taurus Tax Shield- Regular Plan -Dividend Option,INF044D01997,,15.66,15.66,15.66,2012-07-02
116052,Union Long Term Equity Fund - Dividend Option,INF582M01328,INF582M01310,11.24,11.24,11.24,2012-07-02
116051,Union Long Term Equity Fund - Growth Option,INF582M01302,,11.24,11.24,11.24,2012-07-02
100820,UTI - Long Term Equity Fund (Tax Saving) - Regular Plan - Dividend Option,INF789F01521,INF789F01539,15.17,15.17,15.17,2012-07-02
100821,UTI - Long Term Equity Fund (Tax Saving) - Regular Plan - Growth Option,INF789F01547,,38.01,38.01,38.01,2012-07-02
101997,HDFC Overnight Fund - Dividend option (Daily),,,10.4266,10.4266,10.4266,2012-07-02
101996,HDFC Overnight Fund - Growth Option,INF179KB1HS3,,17.7551,17.7551,17.7551,2012-07-02
101206,SBI OVERNIGHT FUND - REGULAR PLAN - GROWTH,INF200K01LQ9,,1893.2765,1893.2765,1893.2765,2012-07-02
103140,SBI OVERNIGHT FUND - REGULAR PLAN - WEEKLY DIVIDEND,INF200K01LO4,INF200K01LP1,1031.6857,1031.6857,1031.6857,2012-07-02
114297,SBI OVERNIGHT FUND - REGULAR PLAN -DAILY DIVIDEND,,INF200K01LN6,1009.9100,1009.9100,1009.9100,2012-07-02
100046,Aditya Birla Sun Life Liquid Fund - Daily Dividend,INF209K01KQ2,INF209K01SQ5,100.1950,100.1950,100.1950,2012-07-02
100047,Aditya Birla Sun Life Liquid Fund - Growth,INF209K01RU9,,176.1785,176.1785,176.1785,2012-07-02
100041,Aditya Birla Sun Life Liquid Fund - Institutional Dividend,,INF209K01KN9,108.0230,108.0230,108.0230,2012-07-02
100051,Aditya Birla Sun Life Liquid Fund - Weekly Dividend,INF209K01KU4,INF209KA1LJ9,100.3026,100.3026,100.3026,2012-07-02
112014,Aditya Birla Sun Life Liquid Fund- Discipline Advantage Plan,INF209K01KZ3,,120.2545,120.2545,120.2545,2012-07-02
100043,Aditya Birla Sun Life Liquid Fund-Institutional (Growth),INF209K01RT1,,294.8572,294.8572,294.8572,2012-07-02
100048,Aditya Birla Sun Life Liquid Fund-Institutional -  Weekly Dividend,INF209KA1LK7,INF209K01KY6,108.1495,108.1495,108.1495,2012-07-02
100044,Aditya Birla Sun Life Liquid Fund-Retail (Dividend),,INF209K01KP4,163.6940,163.6940,163.6940,2012-07-02
100042,Aditya Birla Sun Life Liquid Fund-Retail (Growth),INF209K01ME4,,288.6760,288.6760,288.6760,2012-07-02
112211,Axis Liquid Fund - Regular Plan - Daily Dividend Option,,INF846K01420,1000.1031,1000.1031,1000.1031,2012-07-02
112210,Axis Liquid Fund - Regular Plan - Growth Option,INF846K01412,,1219.2522,1219.2522,1219.2522,2012-07-02
112213,Axis Liquid Fund - Regular Plan - Monthly Dividend Option,INF846K01453,INF846K01461,1001.8621,1001.8621,1001.8621,2012-07-02
112212,Axis Liquid Fund - Regular Plan - Weekly Dividend Option,INF846K01438,INF846K01446,1002.0862,1002.0862,1002.0862,2012-07-02
112712,Axis Liquid Fund - Retail Plan - Daily Dividend Option,,INF846K01362,1000.0753,1000.0753,1000.0753,2012-07-02
112713,Axis Liquid Fund - Retail Plan - Growth Option,INF846K01354,,1191.9235,1191.9235,1191.9235,2012-07-02
112714,Axis Liquid Fund - Retail Plan - Monthly Dividend Option,INF846K01396,INF846K01404,1001.7860,1001.7860,1001.7860,2012-07-02
112715,Axis Liquid Fund - Retail Plan - Weekly Dividend Option,INF846K01370,INF846K01388,1000.0606,1000.0606,1000.0606,2012-07-02
111707,BARODA LIQUID FUND - Plan A - DAILY DIVIDEND OPTION,INF955L01468,INF955L01476,1000.6300,1000.6300,1000.6300,2012-07-02
111704,BARODA LIQUID FUND - Plan A - GROWTH OPTION,INF955L01484,,1260.5043,1260.5043,1260.5043,2012-07-02
101408,BARODA LIQUID FUND- Regular Growth Option,INF955L01575,,1910.4958,1910.4958,1910.4958,2012-07-02
101409,BARODA LIQUID FUND-Regular Daily Dividend Option,INF955L01518,INF955L01526,1006.0600,1006.0600,1006.0600,2012-07-02
101407,BARODA LIQUID FUND-Regular Dividend Option,INF955L01559,INF955L01567,1636.8177,1636.8177,1636.8177,2012-07-02
113641,BNP PARIBAS LIQUID Fund-Institutional Plan-Daily Dividend Option,,,10.0030,10.0030,10.0030,2012-07-02
113634,BNP PARIBAS LIQUID Fund-Institutional Plan-Growth Option,,,16.9261,16.9261,16.9261,2012-07-02
113638,BNP PARIBAS LIQUID Fund-Institutional Plan-Monthly Dividend Payout Option,,,10.0078,10.0078,10.0078,2012-07-02
113642,BNP PARIBAS LIQUID Fund-Institutional Plan-Weekly Dividend Option,,,10.0113,10.0113,10.0113,2012-07-02
113640,BNP PARIBAS LIQUID Fund-Regular Plan-Growth Option,INF251K01CI8,,16.3719,16.3719,16.3719,2012-07-02
113632,BNP PARIBAS LIQUID Fund-Regular Plan-Monthly Dividend,INF251K01CK4,INF251K01CL2,10.0070,10.0070,10.0070,2012-07-02
113637,BNP PARIBAS LIQUID Fund-Regular Plan-Weekly Dividend Option,,INF251K01CJ6,10.0104,10.0104,10.0104,2012-07-02
109257,BOI AXA Liquid Fund- Institutional Plan- Daily Dividend,,,1000.0000,1000.0000,1000.0000,2012-07-02
109256,BOI AXA Liquid Fund- Institutional Plan-Growth,INF761K01314,,1286.7108,1286.7108,1286.7108,2012-07-02
111971,BOI AXA Liquid Fund- Regular Plan- Daily Dividend,,INF761K01CO4,1000.0000,1000.0000,1000.0000,2012-07-02
109254,BOI AXA Liquid Fund- Regular Plan- Growth,INF761K01306,,1268.0135,1268.0135,1268.0135,2012-07-02
109255,BOI AXA Liquid Fund- Regular Plan- Weekly Dividend,,INF761K01CP1,1000.0000,1000.0000,1000.0000,2012-07-02
101363,Canara Robeco Liquid Fund- INSTITUTIONAL-Daily Dividend Reinvestment,,INF760K01CC1,1005.5000,1005.5000,1005.5000,2012-07-02
101362,Canara Robeco Liquid Fund- INSTITUTIONAL-Growth,INF760K01CD9,,1985.7700,1985.7700,1985.7700,2012-07-02
101361,Canara Robeco Liquid Fund- INSTITUTIONAL-Weekly dividend,,INF760K01CE7,1001.3754,1001.3754,1001.3754,2012-07-02
109357,Canara Robeco Liquid Fund-Institutional-Fortnightly Div Reinvest,,INF760K01860,1000.0000,1000.0000,1000.0000,2012-07-02
109352,Canara Robeco Liquid Fund-Institutional-Monthly Div Reinvest,,INF760K01894,1000.0000,1000.0000,1000.0000,2012-07-02
109349,Canara Robeco Liquid Fund-Regular Plan-Daily Div Reinvest.,,INF760K01CU3,1005.5000,1005.5000,1005.5000,2012-07-02
109355,Canara Robeco Liquid Fund-Regular Plan-Fortnightly Div Reinvest.,,INF760K01951,1000.0000,1000.0000,1000.0000,2012-07-02
109353,Canara Robeco Liquid Fund-Regular Plan-Growth,INF760K01CW9,,1337.8808,1337.8808,1337.8808,2012-07-02
109350,Canara Robeco Liquid Fund-Regular Plan-Weekly Div Reinvest.,INF760K01BZ4,INF760K01CZ2,1001.4264,1001.4264,1001.4264,2012-07-02
101364,Canara Robeco Liquid Fund-Retail-DRI,,INF760K01CF4,1007.0001,1007.0001,1007.0001,2012-07-02
109346,Canara Robeco Liquid Fund-Retail-Fortnightly Div Reinvest,,INF760K01CG2,1003.2708,1003.2708,1003.2708,2012-07-02
101365,Canara Robeco Liquid Fund-Retail-Growth,INF760K01CH0,,1964.3323,1964.3323,1964.3323,2012-07-02
109347,Canara Robeco Liquid Fund-Retail-Monthly Div Reinvest,,INF760K01CI8,1006.7883,1006.7883,1006.7883,2012-07-02
109356,Canara Robeco Liquid Fund-Retail-Weekly Div Reinvest,,INF760K01CJ6,1006.7884,1006.7884,1006.7884,2012-07-02
103347,DSP Liquidity Fund - Regular Plan - Growth,INF740K01FK9,,1574.6086,1574.6086,1574.6086,2012-07-02
103348,DSP Liquidity Fund - Regular Plan - Weekly Dividend,,,1001.2010,1001.2010,1001.2010,2012-07-02
103349,DSP Liquidity Fund- Regular Plan - Daily Dividend,,INF740KA1OE0,1000.3161,1000.3161,1000.3161,2012-07-02
100943,DSP BlackRock Liquidity Fund - Regular Plan - Daily Dividend,,,10.0100,10.0100,10.0100,2012-07-02
100940,DSP BlackRock Liquidity Fund - Regular Plan - Growth,INF740K01CN0,,26.0332,26.0332,26.0332,2012-07-02
100941,DSP BlackRock Liquidity Fund - Regular Plan Weekly Dividend,,,12.4225,12.4225,12.4225,2012-07-02
112637,Essel Liquid Fund-Institutional Plan-Dividend Option-Daily,,INF959L01197,10.0015,10.0015,10.0015,2012-07-02
112640,Essel Liquid Fund-Institutional Plan-Growth,INF959L01247,,11.9389,11.9389,11.9389,2012-07-02
112647,Essel Liquid Fund-Regular Plan- Monthly Dividend Option,INF959L01BD7,INF959L01BE5,10.0092,10.0092,10.0092,2012-07-02
112645,Essel Liquid Fund-Regular Plan-Daily Dividend Option,,INF959L01BB1,10.0015,10.0015,10.0015,2012-07-02
112636,Essel Liquid Fund-Regular Plan-Growth Option,INF959L01AV1,,12.0218,12.0218,12.0218,2012-07-02
112646,Essel Liquid Fund-Regular Plan-Weekly Dividend Option,INF959L01AZ2,INF959L01BA3,10.0199,10.0199,10.0199,2012-07-02
112641,Essel Liquid Fund-Retail Plan-Dividend Option-Daily,,INF959L01254,10.0015,10.0015,10.0015,2012-07-02
112643,Essel Liquid Fund-Retail Plan-Dividend Option-Monthly,INF959L01262,INF959L01270,10.0075,10.0075,10.0075,2012-07-02
112642,Essel Liquid Fund-Retail Plan-Dividend Option-Weekly,INF959L01288,INF959L01296,10.0161,10.0161,10.0161,2012-07-02
112644,Essel Liquid Fund-Retail Plan-Growth,INF959L01304,,11.7593,11.7593,11.7593,2012-07-02
100541,Franklin India Liquid Fund - Regular Plan - Daily Dividend,,INF090I01BA3,1512.3400,1512.3400,1512.3400,2012-07-02
100538,Franklin India Liquid Fund - Regular Plan - Growth,INF090I01BB1,,2679.5584,2679.5584,2679.5584,2012-07-02
100537,Franklin India Liquid Fund - Regular Plan - Weekly Dividend,INF090I01BL0,INF090I01BI6,1244.3238,1244.3238,1244.3238,2012-07-02
100547,Franklin India Liquid Fund - Super Institutional Plan - Daily Dividend,,INF090I01BF2,1000.6730,1000.6730,1000.6730,2012-07-02
100546,Franklin India Liquid Fund - Super Institutional Plan - Growth,INF090I01BG0,,1637.3200,1637.3200,1637.3200,2012-07-02
100548,Franklin India Liquid Fund - Super Institutional Plan - Weekly Dividend,INF090I01BM8,INF090I01BH8,1021.1243,1021.1243,1021.1243,2012-07-02
102443,Franklin India Liquid Fund - Institution-Daily,,INF090I01BC9,1000.6730,1000.6730,1000.6730,2012-07-02
102441,Franklin India Liquid Fund - Institution-Growth,INF090I01BD7,,1708.3439,1708.3439,1708.3439,2012-07-02
102442,Franklin India Liquid Fund - Institution-Weekly,INF090I01BJ4,INF090I01BE5,1054.7186,1054.7186,1054.7186,2012-07-02
100875,HDFC Liquid Fund-Dividend - Daily,,INF179KB1IC5,10.1982,10.1982,10.1982,2012-07-02
100876,HDFC Liquid Fund-Dividend - Monthly,INF179KB1HM6,INF179KB1HL8,10.2818,10.2818,10.2818,2012-07-02
100874,HDFC Liquid Fund-Dividend - Weekly,INF179KB1ID3,,10.3291,10.3291,10.3291,2012-07-02
100868,HDFC Liquid Fund-GROWTH,INF179KB1HK0,,21.7041,21.7041,21.7041,2012-07-02
100877,HDFC Liquid Fund-Premium Plan - Dividend-Daily,,INF179K01KN4,12.2598,12.2598,12.2598,2012-07-02
100878,HDFC Liquid Fund-Premium Plan - Dividend-Weekly,INF179K01KP9,,10.1186,10.1186,10.1186,2012-07-02
100872,HDFC Liquid Fund-PREMIUM PLUS- Growth,INF179K01KQ7,,22.082,22.082,22.082,2012-07-02
100873,HDFC Liquid Fund-PREMIUM- Growth,INF179KB1HN4,,22.0374,22.0374,22.0374,2012-07-02
101700,HSBC Cash Fund - Dividend - Daily,,INF336L01321,10.0056,10.0056,10.0056,2012-07-02
101702,HSBC Cash Fund - Dividend - Monthly,INF336L01305,INF336L01297,0.0000,0.0000,0.0000,2012-07-02
101701,HSBC Cash Fund - Dividend - Weekly,,INF336L01347,10.9559,10.9559,10.9559,2012-07-02
101699,HSBC Cash Fund - Growth,INF336L01339,,10.9816,10.9816,10.9816,2012-07-02
101692,HSBC Cash Fund - Inst. - Dividend - Daily,,INF336L01354,10.4401,10.4401,10.4401,2012-07-02
101694,HSBC Cash Fund - Inst. - Dividend - Monthly,INF336L01370,INF336L01362,10.5286,10.5286,10.5286,2012-07-02
101693,HSBC Cash Fund - Inst. - Dividend - Weekly,,INF336L01388,10.8700,10.8700,10.8700,2012-07-02
101691,HSBC Cash Fund - Inst. - Growth,INF336L01289,,17.5618,17.5618,17.5618,2012-07-02
101697,HSBC Cash Fund - Regular - Dividend - Daily,,INF336L01263,10.1930,10.1930,10.1930,2012-07-02
101698,HSBC Cash Fund - Regular - Dividend - Weekly,,INF336L01313,10.0235,10.0235,10.0235,2012-07-02
